English|Portugese
their house is old.|a moradia delas esta velha
we enjoyed working together.|nos iniciamos a gente em conjunto de sol !
the information is on their website.|o aviso esta na equipe de artes
walk to the middle of the block.|va a ir para o peixe do quarteirao
the cabinet on the right is empty.|o trabalho se ao calice e setenta
the singer hasn't recorded an album since the accident.|a macaca so nao um meio dia de computador desde o temporal
did you lose your cellphone?|voce conseguiu o seu telefone ?
i have never won a competition.|eu jamais tenho uma notificacao
why do we have to learn so much vocabulary?|por que nos temos que muito depressa ?
what level of english are you studying?|que medida de idioma ingles e ?
where's the exit?|onde esta a fazenda ?
could you get the documents from the printer?|voce pode me os oculos de ela ?
where's the closest hotel?|onde e o hospital mais proximo ?
will these curtains look good in the living room?|estas cortinas sao ouro lemos para a sala ?
fred cannot play the guitar.|o fred nao esta a tocar o violao
is your father here?|o teu pai esta aqui ?
the boy had come from school.|o menino tentava veio na escola
i stayed with my grandparents until the end of the semester.|eu dormi com os meus colegas no semestre
i am good, thank you.|eu estou otimo , obrigada
how are you doing, mr. turner?|como voce vai estar o seu turner ?
everybody needs water.|todos as plantas precisam de agua
this homework is very easy.|este dever de arte e muito facil
you will like the tomatoes from the garden.|voce vai gostar da galinha do topo do barulho
at what age do children start paying?|no que esta partindo do patos ?
i hope your wish will come true.|eu espero que eu ja enxergamos mais
i've done this lesson already.|eu ja assisti a essa aula ha pouco
that bear eats quite a lot of sweets.|aquela gata esta a comer muito bom de bombons
when you decide, let me know.|quando voce evita ali
they had decided to stay.|eles tinham decidiu cobrir antes de boi
she cut her finger while she was making dinner.|ela cortou o seu dedo quando estava surfando
what kind of juice would you like?|que tipo de um poder que voce curte ?
