English|Portugese
i could ask for everything that i wanted.|eu nao posso lembrar de correio mais
unfortunately, she has a terrible headache.|desafortunadamente , nao esta assegure se em excesso
we wash dishes at a restaurant.|nos estamos a cada
do you have thirty dollars?|possuis dolares ?
their house is old.|a residencia deles esta maior do que a nossa
we enjoyed working together.|nos fomos no ultimo ano passado
the information is on their website.|o aviso esta na placa do ambiente de recreacao
walk to the middle of the block.|vao a esquina e faz para a esquerda
the cabinet on the right is empty.|o arroz esta na geladeira
the singer hasn't recorded an album since the accident.|o animais foram ate o rio
did you lose your cellphone?|voce e que faltavam ?
i have never won a competition.|eu tenho uma avaliacao
why do we have to learn so much vocabulary?|porque e que nos temos de vestir farda ?
what level of english are you studying?|que hora te despertas ?
where's the exit?|o que lugar e que esta o hospital mais proximo ?
could you get the documents from the printer?|voce pode acender a iluminacao da sala de convivio ?
where's the closest hotel?|o hospital mais perto esta em que lugar ?
will these curtains look good in the living room?|nos conseguimos comprar esses copos com a iluminacao e esses copos com a iluminacao e esses copos com a iluminacao
fred cannot play the guitar.|o fred tem o violino
is your father here?|o teu voces estao a cursar o o teu
the boy had come from school.|o moco tentava fazer um medo de caes
i stayed with my grandparents until the end of the semester.|eu fui me a avaliacao
i am good, thank you.|eu estou bem bom
how are you doing, mr. turner?|como e que tu estas indo ?
everybody needs water.|tem de de de de de de de de de de de de de de de de de de de
this homework is very easy.|este dever de artes esta muito complicada
you will like the tomatoes from the garden.|voce vai achar o lavar o quadro
at what age do children start paying?|de momento eu estou desempregada
i hope your wish will come true.|eu estou a adorar a sua calca jeans
i've done this lesson already.|eu ja assisti essa pelicula
that bear eats quite a lot of sweets.|esse lencol nao tem com os seus jeans
when you decide, let me know.|quando voce comeu ?
they had decided to stay.|elas passaram por um incidente serio
she cut her finger while she was making dinner.|ela cortou a sua familia
what kind of juice would you like?|qual sorte de dicionario voce esta utilizando ?
